{
  "$schema": "https://json-schema.org/draft/2020-12/schema",
  "type": "object",
  "additionalProperties": false,
  "required": [
    "task_id",
    "answers",
    "conclusion"
  ],
  "properties": {
    "task_id": {
      "type": "string",
      "pattern": "^challenge-v1-[abc]0[1-4]$"
    },
    "answers": {
      "type": "array",
      "minItems": 1,
      "maxItems": 5,
      "items": {
        "type": "object",
        "additionalProperties": false,
        "required": [
          "id",
          "status",
          "value",
          "unit",
          "evidence",
          "sql"
        ],
        "properties": {
          "id": {
            "type": "string",
            "minLength": 1,
            "maxLength": 64
          },
          "status": {
            "enum": [
              "answered",
              "insufficient_evidence"
            ]
          },
          "value": {
            "type": [
              "number",
              "null"
            ]
          },
          "unit": {
            "type": "string",
            "minLength": 1,
            "maxLength": 64
          },
          "evidence": {
            "type": "array",
            "items": {
              "type": "string",
              "minLength": 1,
              "maxLength": 100
            },
            "minItems": 0,
            "maxItems": 10,
            "uniqueItems": true
          },
          "sql": {
            "type": [
              "string",
              "null"
            ],
            "minLength": 1,
            "maxLength": 16384
          },
          "reason_code": {
            "enum": [
              "no_eligible_observation",
              "missing_comparable_definition",
              "missing_required_labels",
              "missing_required_input",
              null
            ]
          }
        },
        "allOf": [
          {
            "if": {
              "properties": {
                "status": {
                  "const": "answered"
                }
              }
            },
            "then": {
              "properties": {
                "value": {
                  "type": "number"
                },
                "sql": {
                  "type": "string"
                },
                "reason_code": {
                  "type": "null"
                }
              }
            },
            "else": {
              "properties": {
                "value": {
                  "type": "null"
                },
                "sql": {
                  "type": "null"
                },
                "reason_code": {
                  "enum": [
                    "no_eligible_observation",
                    "missing_comparable_definition",
                    "missing_required_labels",
                    "missing_required_input"
                  ]
                }
              }
            }
          }
        ]
      }
    },
    "conclusion": {
      "oneOf": [
        {
          "type": "null"
        },
        {
          "type": "object",
          "additionalProperties": false,
          "required": [
            "verdict",
            "evidence"
          ],
          "properties": {
            "verdict": {
              "enum": [
                "supported",
                "contradicted",
                "not_established"
              ]
            },
            "reason_code": {
              "enum": [
                "supported_by_calculation",
                "contradicted_by_calculation",
                "incompatible_definition",
                "incompatible_coverage",
                "ineligible_source",
                "missing_required_evidence",
                null
              ]
            },
            "evidence": {
              "type": "array",
              "items": {
                "type": "string",
                "minLength": 1,
                "maxLength": 100
              },
              "minItems": 0,
              "maxItems": 10,
              "uniqueItems": true
            }
          }
        }
      ]
    },
    "context_evidence": {
      "type": "array",
      "items": {
        "type": "string",
        "minLength": 1,
        "maxLength": 100
      },
      "maxItems": 10,
      "uniqueItems": true
    }
  },
  "$id": "https://github.com/CaoimhConway/workpaperbench/challenge-v1/workpaper-1.1"
}
